{
  "schema_version": "1.0.0",
  "graph_id": "TG-EVOLV-2026-001",
  "generated_at": "2026-02-26T12:00:00Z",
  "generated_by": "SentinelAgent/bootstrap",
  "integrity_hash": "a3f8d2c1e9b74056f1d2a3c4e5f67890abcdef1234567890abcdef1234567890",

  "requirements": [
    {
      "req_id": "URS-6.1",
      "req_type": "URS",
      "title": "Generate URS from natural language input",
      "statement": "The system shall generate a structured User Requirements Specification from a natural language description, grounded in GAMP 5 regulatory context retrieved from the knowledge base.",
      "risk_level": "High",
      "criticality_score": 3,
      "gxp_category": "GxP Direct",
      "regulatory_reference": "GAMP 5 Rev 2, Section 6.3 — Requirements Management",
      "parent_req_id": null,
      "status": "Approved"
    },
    {
      "req_id": "URS-6.9",
      "req_type": "URS",
      "title": "Assess requirement criticality",
      "statement": "The system shall classify each generated requirement as High, Medium, or Low criticality based on GxP keyword analysis.",
      "risk_level": "High",
      "criticality_score": 3,
      "gxp_category": "GxP Direct",
      "regulatory_reference": "GAMP 5 Rev 2, Appendix M — Risk Assessment",
      "parent_req_id": "URS-6.1",
      "status": "Approved"
    },
    {
      "req_id": "URS-12.1",
      "req_type": "URS",
      "title": "Verify generated URS against GAMP 5 text",
      "statement": "The system shall verify every generated URS document against GAMP 5 regulatory text stored in the knowledge base before releasing it for use.",
      "risk_level": "High",
      "criticality_score": 3,
      "gxp_category": "GxP Direct",
      "regulatory_reference": "21 CFR Part 11.10(e) — Audit controls; GAMP 5 Rev 2, Section 7",
      "parent_req_id": null,
      "status": "Approved"
    },
    {
      "req_id": "URS-12.10",
      "req_type": "URS",
      "title": "Detect criticality misclassification",
      "statement": "The system shall flag any URS where the assigned criticality may be under-classified relative to GAMP 5 high-risk indicators.",
      "risk_level": "High",
      "criticality_score": 3,
      "gxp_category": "GxP Direct",
      "regulatory_reference": "GAMP 5 Rev 2, Appendix M",
      "parent_req_id": "URS-12.1",
      "status": "Approved"
    },
    {
      "req_id": "URS-4.2",
      "req_type": "URS",
      "title": "Calculate risk using GAMP 5 methodology",
      "statement": "The system shall calculate a Risk Priority Number (RPN) using Severity × Occurrence × Detectability, and map it to Low/Medium/High risk levels.",
      "risk_level": "High",
      "criticality_score": 3,
      "gxp_category": "GxP Direct",
      "regulatory_reference": "GAMP 5 Rev 2, Section 5 — Risk Management",
      "parent_req_id": null,
      "status": "Approved"
    },
    {
      "req_id": "URS-13.1",
      "req_type": "URS",
      "title": "Archive AI reasoning alongside audit records",
      "statement": "The system shall persist a structured AI reasoning chain (inputs, steps, outputs) alongside every audit trail entry, with a tamper-evident SHA-256 integrity hash.",
      "risk_level": "Medium",
      "criticality_score": 2,
      "gxp_category": "GxP Direct",
      "regulatory_reference": "21 CFR Part 11.10(e) — Audit controls",
      "parent_req_id": null,
      "status": "Approved"
    },
    {
      "req_id": "URS-17.1",
      "req_type": "URS",
      "title": "Generate CSA test scripts from UR/FR documents",
      "statement": "The system shall generate structured CSA test scripts from UR/FR documents, routing to scripted (IQ/OQ/UAT) or charter (exploratory) formats based on risk level.",
      "risk_level": "Medium",
      "criticality_score": 2,
      "gxp_category": "GxP Indirect",
      "regulatory_reference": "GAMP 5 Rev 2, Section 6.5 — Testing",
      "parent_req_id": null,
      "status": "Approved"
    },
    {
      "req_id": "URS-2.1",
      "req_type": "URS",
      "title": "Maintain 21 CFR Part 11 compliant audit trail",
      "statement": "The system shall maintain an append-only, tamper-evident CSV audit trail recording all agent actions with timestamps, user IDs, and SHA-256 reasoning hashes.",
      "risk_level": "High",
      "criticality_score": 3,
      "gxp_category": "GxP Direct",
      "regulatory_reference": "21 CFR Part 11.10(e) and 11.10(k)",
      "parent_req_id": null,
      "status": "Approved"
    }
  ],

  "code_modules": [
    {
      "module_id": "MOD-REQ-ARCH",
      "file_path": "Agents/requirement_architect.py",
      "module_name": "Agents.requirement_architect",
      "description": "RequirementArchitect agent — generates URS documents from natural language using GAMP 5 Pinecone context.",
      "functions": [
        {
          "function_name": "generate_urs",
          "class_name": "RequirementArchitect",
          "line_start": 180,
          "line_end": 260,
          "criticality_override": null
        },
        {
          "function_name": "_determine_criticality",
          "class_name": "RequirementArchitect",
          "line_start": 120,
          "line_end": 155,
          "criticality_override": "High"
        },
        {
          "function_name": "_build_regulatory_rationale",
          "class_name": "RequirementArchitect",
          "line_start": 156,
          "line_end": 179,
          "criticality_override": null
        },
        {
          "function_name": "transform_urs_to_ur_fr",
          "class_name": "RequirementArchitect",
          "line_start": 261,
          "line_end": 360,
          "criticality_override": null
        }
      ]
    },
    {
      "module_id": "MOD-VERIF",
      "file_path": "Agents/verification_agent.py",
      "module_name": "Agents.verification_agent",
      "description": "VerificationAgent — validates generated URS against GAMP 5 text; performs criticality alignment, rationale relevance, and contradiction scan checks.",
      "functions": [
        {
          "function_name": "verify_urs",
          "class_name": "VerificationAgent",
          "line_start": 110,
          "line_end": 200,
          "criticality_override": null
        },
        {
          "function_name": "_check_criticality_alignment",
          "class_name": "VerificationAgent",
          "line_start": 201,
          "line_end": 255,
          "criticality_override": "High"
        },
        {
          "function_name": "_check_rationale_relevance",
          "class_name": "VerificationAgent",
          "line_start": 256,
          "line_end": 295,
          "criticality_override": null
        },
        {
          "function_name": "_check_contradictions",
          "class_name": "VerificationAgent",
          "line_start": 296,
          "line_end": 350,
          "criticality_override": null
        }
      ]
    },
    {
      "module_id": "MOD-RISK",
      "file_path": "Agents/risk_strategist.py",
      "module_name": "Agents.risk_strategist",
      "description": "Risk Strategist — GAMP 5 RPN calculation, CSA testing strategy recommendation, ServiceNow field mapping.",
      "functions": [
        {
          "function_name": "calculate_risk_score",
          "class_name": null,
          "line_start": 55,
          "line_end": 95,
          "criticality_override": "High"
        },
        {
          "function_name": "assess_change_request",
          "class_name": null,
          "line_start": 96,
          "line_end": 145,
          "criticality_override": null
        },
        {
          "function_name": "get_csa_testing_strategy",
          "class_name": null,
          "line_start": 146,
          "line_end": 175,
          "criticality_override": null
        }
      ]
    },
    {
      "module_id": "MOD-INTEGRITY",
      "file_path": "Agents/integrity_manager.py",
      "module_name": "Agents.integrity_manager",
      "description": "Integrity Manager — append-only CSV audit trail and logic archive writer with SHA-256 tamper detection.",
      "functions": [
        {
          "function_name": "log_audit_event",
          "class_name": null,
          "line_start": 80,
          "line_end": 145,
          "criticality_override": "High"
        },
        {
          "function_name": "_compute_reasoning_hash",
          "class_name": null,
          "line_start": 146,
          "line_end": 175,
          "criticality_override": "High"
        },
        {
          "function_name": "_write_logic_archive",
          "class_name": null,
          "line_start": 176,
          "line_end": 240,
          "criticality_override": null
        }
      ]
    },
    {
      "module_id": "MOD-DELTA",
      "file_path": "Agents/delta_agent.py",
      "module_name": "Agents.delta_agent",
      "description": "Delta Agent — deterministic CSA test script generation from UR/FR documents; routes by risk level to scripted or charter outputs.",
      "functions": [
        {
          "function_name": "generate_csa_test_from_ur_fr",
          "class_name": "DeltaAgent",
          "line_start": 95,
          "line_end": 165,
          "criticality_override": null
        },
        {
          "function_name": "_build_positive_steps",
          "class_name": "DeltaAgent",
          "line_start": 166,
          "line_end": 215,
          "criticality_override": null
        },
        {
          "function_name": "_build_negative_steps",
          "class_name": "DeltaAgent",
          "line_start": 216,
          "line_end": 260,
          "criticality_override": null
        }
      ]
    }
  ],

  "test_scripts": [
    {
      "script_id": "OQ-URS6-001",
      "phase": "OQ",
      "title": "OQ: URS Generation from Natural Language — Functional Verification",
      "execution_priority": "Critical",
      "test_type": "Formal OQ",
      "automation_status": "Manual",
      "owner": "CSV Validation Lead",
      "last_executed_at": "2026-01-15T09:00:00Z"
    },
    {
      "script_id": "OQ-URS6-002",